{
  "schema_version": "1.0.0",
  "generated_at": "2026-05-04T12:00:00Z",
  "source": "markdown_frontmatter",
  "entries": [
    {
      "path": "b.md",
      "type": "unknown",
      "module": "unknown",
      "status": "unknown",
      "authority": "unknown",
      "created": "unknown",
      "last_validated": "unknown"
    }
  ]
}
